{
  "description": "Science capability progression map \u2014 Science as a Human Endeavour (H) and Science Inquiry (I) strands, Foundation\u2013Y10. Band-based: F, Y1-2, Y3-4, Y5-6, Y7-8, Y9-10. One canonical descriptor per band using the lower year code.",
  "subject": "Science",
  "curriculum": "ACARA v9",
  "levels": {
    "F": {
      "label": "Foundation",
      "standards": [
        {
          "code": "AC9SFH01",
          "title": "People observe and question the world",
          "description": "Explore the ways people make and use observations and questions to learn about the natural world",
          "capability_goal": "Students explore how people use observations and questions to learn about the natural world.",
          "sub_strand": "use_of_science",
          "level_key": "F"
        },
        {
          "code": "AC9SFI01",
          "title": "Pose simple questions from experience",
          "description": "Pose questions and make predictions based on experiences",
          "capability_goal": "Students pose simple questions and make predictions based on their experiences.",
          "sub_strand": "questioning",
          "level_key": "F"
        },
        {
          "code": "AC9SFI02",
          "title": "Investigate safely using senses",
          "description": "Engage in investigations safely and make observations using their senses",
          "capability_goal": "Students engage safely in investigations and make observations using their senses.",
          "sub_strand": "planning",
          "level_key": "F"
        },
        {
          "code": "AC9SFI03",
          "title": "Record observations in templates",
          "description": "Represent observations in provided templates and identify patterns with guidance",
          "capability_goal": "Students represent observations in provided templates and identify simple patterns with guidance.",
          "sub_strand": "processing",
          "level_key": "F"
        },
        {
          "code": "AC9SFI04",
          "title": "Compare observations with predictions",
          "description": "Compare observations with predictions with guidance",
          "capability_goal": "Students compare observations with predictions with guidance.",
          "sub_strand": "evaluating",
          "level_key": "F"
        },
        {
          "code": "AC9SFI05",
          "title": "Share questions and observations",
          "description": "Share questions, predictions, observations and ideas with others",
          "capability_goal": "Students share questions, predictions, observations and ideas with others.",
          "sub_strand": "communicating",
          "level_key": "F"
        }
      ]
    },
    "1-2": {
      "label": "Years 1-2",
      "standards": [
        {
          "code": "AC9S1H01",
          "title": "Describe science in daily life",
          "description": "Describe how people use science in their daily lives, including using patterns to make scientific predictions",
          "capability_goal": "Students describe how people use science in daily life, including using patterns to make scientific predictions.",
          "sub_strand": "use_of_science",
          "level_key": "1-2"
        },
        {
          "code": "AC9S1I01",
          "title": "Pose questions about patterns",
          "description": "Pose questions to explore observed simple patterns and relationships and make predictions based on experiences",
          "capability_goal": "Students pose questions to explore simple patterns and relationships and make predictions based on experiences.",
          "sub_strand": "questioning",
          "level_key": "1-2"
        },
        {
          "code": "AC9S1I02",
          "title": "Suggest safe procedures",
          "description": "Suggest and follow safe procedures to investigate questions and test predictions",
          "capability_goal": "Students suggest and follow safe procedures to investigate questions and test predictions.",
          "sub_strand": "planning",
          "level_key": "1-2"
        },
        {
          "code": "AC9S1I03",
          "title": "Record with informal measurements",
          "description": "Make and record observations, including informal measurements, using digital tools as appropriate",
          "capability_goal": "Students make and record observations including informal measurements, using digital tools as appropriate.",
          "sub_strand": "planning",
          "level_key": "1-2"
        },
        {
          "code": "AC9S1I04",
          "title": "Sort data and show patterns",
          "description": "Sort and order data and information and represent patterns, including with provided tables and visual or physical models",
          "capability_goal": "Students sort and order data and represent patterns using provided tables and visual or physical models.",
          "sub_strand": "processing",
          "level_key": "1-2"
        },
        {
          "code": "AC9S1I05",
          "title": "Compare findings for fairness",
          "description": "Compare observations with predictions and others' observations, consider if investigations are fair and identify further questions with guidance",
          "capability_goal": "Students compare observations with predictions and others' observations, consider fairness of investigations and identify further questions with guidance.",
          "sub_strand": "evaluating",
          "level_key": "1-2"
        },
        {
          "code": "AC9S1I06",
          "title": "Write observations and findings",
          "description": "Write and create texts to communicate observations, findings and ideas, using everyday and scientific vocabulary",
          "capability_goal": "Students write and create texts to communicate observations, findings and ideas using everyday and scientific vocabulary.",
          "sub_strand": "communicating",
          "level_key": "1-2"
        }
      ]
    },
    "3-4": {
      "label": "Years 3-4",
      "standards": [
        {
          "code": "AC9S3H01",
          "title": "Data builds scientific explanations",
          "description": "Examine how people use data to develop scientific explanations",
          "capability_goal": "Students examine how people use data to develop scientific explanations.",
          "sub_strand": "nature_of_science",
          "level_key": "3-4"
        },
        {
          "code": "AC9S3H02",
          "title": "Science applied to solve problems",
          "description": "Consider how people use scientific explanations to meet a need or solve a problem",
          "capability_goal": "Students consider how people apply scientific explanations to meet needs and solve problems.",
          "sub_strand": "use_of_science",
          "level_key": "3-4"
        },
        {
          "code": "AC9S3I01",
          "title": "Pose questions from observations",
          "description": "Pose questions to explore observed patterns and relationships and make predictions based on observations",
          "capability_goal": "Students pose questions to explore patterns and relationships and make predictions based on observations.",
          "sub_strand": "questioning",
          "level_key": "3-4"
        },
        {
          "code": "AC9S3I02",
          "title": "Plan fair tests with scaffolds",
          "description": "Use provided scaffolds to plan and conduct investigations to answer questions or test predictions, including identifying the elements of fair tests, and considering the safe use of materials and equipment",
          "capability_goal": "Students use provided scaffolds to plan and conduct fair-test investigations, identifying key elements and considering safe equipment use.",
          "sub_strand": "planning",
          "level_key": "3-4"
        },
        {
          "code": "AC9S3I03",
          "title": "Measure with scaled instruments",
          "description": "Follow procedures to make and record observations, including making formal measurements using familiar scaled instruments and using digital tools as appropriate",
          "capability_goal": "Students follow procedures to make and record formal measurements using scaled instruments.",
          "sub_strand": "planning",
          "level_key": "3-4"
        },
        {
          "code": "AC9S3I04",
          "title": "Construct tables and graphs",
          "description": "Construct and use representations, including tables, simple column graphs and visual or physical models, to organise data and information, show simple relationships and identify patterns",
          "capability_goal": "Students construct and use tables, column graphs and models to organise data and identify patterns and simple relationships.",
          "sub_strand": "processing",
          "level_key": "3-4"
        },
        {
          "code": "AC9S3I05",
          "title": "Compare findings and conclude",
          "description": "Compare findings with those of others, consider if investigations were fair, identify questions for further investigation and draw conclusions",
          "capability_goal": "Students compare findings with others, consider fairness of investigations, identify further questions and draw conclusions.",
          "sub_strand": "evaluating",
          "level_key": "3-4"
        },
        {
          "code": "AC9S3I06",
          "title": "Write for purpose and audience",
          "description": "Write and create texts to communicate findings and ideas for identified purposes and audiences, using scientific vocabulary and digital tools as appropriate",
          "capability_goal": "Students write and create texts to communicate findings and ideas for identified purposes and audiences using scientific vocabulary.",
          "sub_strand": "communicating",
          "level_key": "3-4"
        }
      ]
    },
    "5-6": {
      "label": "Years 5-6",
      "standards": [
        {